{
  "protocol": "warp:1.0.0",
  "name": "PeerMe: Boost",
  "title": "Boost xAlliance",
  "description": "Boost xAlliance with USDC to increase the DAOs energy.",
  "vars": {
    "AMOUNT": "query:amount"
  },
  "actions": [
    {
      "type": "contract",
      "label": "Boost now",
      "address": "erd1qqqqqqqqqqqqqpgqtatmxjhlxkehl37u5kz9tz7sm450xd7f27rsppynzj",
      "func": "boost",
      "args": [
        "address:erd1qqqqqqqqqqqqqpgqsrkgkrv594hnruqphmtera490a6tzvmz27rsggj6an"
      ],
      "gasLimit": 20000000,
      "inputs": [
        {
          "name": "USDC amount",
          "type": "esdt",
          "position": "transfer",
          "source": "field",
          "required": true,
          "options": ["USDC-c76f1f"]
        }
      ]
    }
  ]
}
